{
  "$schema": "https://json-schema.org/draft/2020-12/schema",
  "$id": "https://getbusbar.com/schemas/conformance-verdict-1.json",
  "title": "busbar.conformance.verdict/1",
  "description": "One suite's arm-or-red fact, as its rig judged it. Each repo's ModernCI `conformance` check (testing/conformance/run.sh) writes one `<suite>.json` per suite it ran, stamped with its repo, commit and core pin; `scripts/conformance/import.sh` brings them here and `python3 scripts/conformance/sync.py --write` renders the manifest. Every verdict is held to this schema before it is read, and a verdict whose `suite` is not the id it is filed under is refused. A registered suite with no verdict file is not-run, never green. Rules: armed==false requires status \"not-run\", so status \"pass\" requires armed==true; `commit` is the sha the SUBJECT was built from, which is what makes staleness detectable.",
  "type": "object",
  "additionalProperties": false,
  "required": ["schema", "suite", "status", "armed", "commit"],
  "properties": {
    "schema": { "const": "busbar.conformance.verdict/1" },
    "suite": { "type": "string", "description": "Stable suite id, matching the registry and the file's own name." },
    "standard": { "type": "string" },
    "plan": { "type": "string" },
    "spec_version": { "type": "string", "description": "The spec/plan revision judged." },
    "status": { "enum": ["pass", "fail", "not-run"] },
    "armed": { "type": "boolean", "description": "false ⇒ status MUST be not-run." },
    "commit": { "type": "string", "description": "The sha the subject was built from: the judged commit of `repo`." },
    "repo": { "type": "string", "description": "The repo whose check judged the suite (owner/name); its freshness is judged against that repo's dev head." },
    "core_pin": { "type": "string", "description": "The busbar core sha the subject was built against (a plugin's .busbar-ref pin; busbar's own HEAD for a core suite)." },
    "run_id": { "type": "string" },
    "evidence": { "type": "string" },
    "generated_at": { "type": "string" },
    "reason": { "type": "string" },
    "cert_id": { "type": "string", "description": "certified tier only: the issued cert id." },
    "issuer": { "type": "string", "description": "certified tier only: the body that issued it." },
    "expires": { "type": "string", "description": "certified tier only: cert validity end." }
  }
}
